{
  "$schema": "https://json-schema.org/draft/2020-12/schema",
  "$id": "https://x07.io/schemas/x07.mcp.scan.report.schema.json",
  "title": "x07.mcp.scan.report@0.4.0",
  "type": "object",
  "additionalProperties": false,
  "required": [
    "schema_version",
    "tool",
    "tool_family",
    "tool_version",
    "report_kind",
    "target",
    "transport",
    "generated_at",
    "methodology_version",
    "status",
    "overall_status",
    "score_available",
    "score_mode",
    "score_truth_status",
    "score_weight_present",
    "overall_score",
    "partial_score",
    "dimension_coverage",
    "unknown_dimensions",
    "partial_reasons",
    "gating_reasons",
    "dimensions",
    "usage_metrics",
    "findings",
    "artifacts",
    "spec_baseline",
    "report_digest",
    "run_id",
    "elapsed_ms"
  ],
  "properties": {
    "schema_version": { "const": "x07.mcp.scan.report@0.4.0" },
    "tool": { "type": "string", "minLength": 1 },
    "tool_family": { "type": "string", "minLength": 1 },
    "tool_version": { "type": "string", "minLength": 1 },
    "report_kind": { "type": "string", "minLength": 1 },
    "target": { "$ref": "#/$defs/target" },
    "transport": { "type": "string", "enum": ["streamable_http", "stdio"] },
    "generated_at": { "type": "string", "format": "date-time" },
    "methodology_version": { "type": "string", "minLength": 1 },
    "status": { "type": "string", "enum": ["pass", "warn", "fail", "unknown"] },
    "overall_status": { "type": "string", "enum": ["pass", "warn", "fail", "unknown"] },
    "score_available": { "type": "boolean" },
    "score_mode": { "type": "string", "enum": ["full", "partial"] },
    "score_truth_status": { "type": "string", "enum": ["publishable", "partial", "insufficient"] },
    "score_weight_present": { "type": "integer", "minimum": 0, "maximum": 100 },
    "overall_score": { "type": ["integer", "null"], "minimum": 0, "maximum": 100 },
    "partial_score": { "type": ["integer", "null"], "minimum": 0, "maximum": 100 },
    "dimension_coverage": { "$ref": "#/$defs/dimension_coverage" },
    "unknown_dimensions": {
      "type": "array",
      "items": { "$ref": "#/$defs/dimension_name" }
    },
    "partial_reasons": {
      "type": "array",
      "items": { "type": "string", "minLength": 1 }
    },
    "gating_reasons": {
      "type": "array",
      "items": { "type": "string", "minLength": 1 }
    },
    "dimensions": {
      "type": "array",
      "minItems": 1,
      "items": { "$ref": "#/$defs/dimension" }
    },
    "usage_metrics": { "$ref": "#/$defs/usage_metrics" },
    "findings": { "type": "array", "items": { "$ref": "#/$defs/finding" } },
    "artifacts": { "type": "array", "items": { "$ref": "#/$defs/artifact" } },
    "spec_baseline": { "type": "string", "minLength": 1 },
    "report_digest": { "$ref": "#/$defs/sha256_hex" },
    "run_id": { "type": "string", "minLength": 1 },
    "elapsed_ms": { "type": "integer", "minimum": 0 }
  },
  "$defs": {
    "sha256_hex": {
      "type": "string",
      "minLength": 64,
      "maxLength": 64,
      "pattern": "^[0-9a-f]{64}$"
    },
    "dimension_name": {
      "type": "string",
      "enum": ["conformance", "security", "performance", "trust", "reliability"]
    },
    "target": {
      "type": "object",
      "additionalProperties": false,
      "required": ["kind", "transport", "ref", "meta"],
      "properties": {
        "kind": { "enum": ["mcp_server", "file"] },
        "transport": { "enum": ["streamable_http", "stdio", "file"] },
        "ref": { "type": "string", "minLength": 1 },
        "meta": { "type": "object", "additionalProperties": true }
      }
    },
    "artifact": {
      "type": "object",
      "additionalProperties": false,
      "required": ["id", "kind", "path", "digest", "content_type"],
      "properties": {
        "id": { "type": "string", "minLength": 1 },
        "kind": { "type": "string", "minLength": 1 },
        "path": { "type": "string", "minLength": 1 },
        "digest": { "$ref": "#/$defs/sha256_hex" },
        "content_type": { "type": "string", "minLength": 1 }
      }
    },
    "dimension_coverage": {
      "type": "object",
      "additionalProperties": false,
      "required": ["conformance", "security", "performance", "trust", "reliability"],
      "properties": {
        "conformance": { "type": "boolean" },
        "security": { "type": "boolean" },
        "performance": { "type": "boolean" },
        "trust": { "type": "boolean" },
        "reliability": { "type": "boolean" }
      }
    },
    "dimension": {
      "type": "object",
      "additionalProperties": false,
      "required": [
        "name",
        "status",
        "score",
        "weight",
        "metrics",
        "finding_refs",
        "artifact_refs"
      ],
      "properties": {
        "name": { "$ref": "#/$defs/dimension_name" },
        "status": { "type": "string", "enum": ["pass", "warn", "fail", "unknown"] },
        "score": { "type": ["integer", "null"], "minimum": 0, "maximum": 100 },
        "weight": { "type": "number", "minimum": 0, "maximum": 1 },
        "metrics": { "type": "object", "additionalProperties": true },
        "finding_refs": { "type": "array", "items": { "type": "string", "minLength": 1 } },
        "artifact_refs": { "type": "array", "items": { "type": "string", "minLength": 1 } }
      }
    },
    "finding": {
      "type": "object",
      "additionalProperties": false,
      "required": [
        "code",
        "dimension",
        "severity",
        "title",
        "summary",
        "evidence",
        "suggested_fix",
        "docs_ref"
      ],
      "properties": {
        "code": { "type": "string", "minLength": 1 },
        "dimension": {
          "type": "string",
          "enum": ["conformance", "security", "performance", "trust", "reliability", "usage"]
        },
        "severity": { "type": "string", "enum": ["info", "warning", "critical"] },
        "title": { "type": "string", "minLength": 1 },
        "summary": { "type": "string", "minLength": 1 },
        "evidence": { "type": "object", "additionalProperties": true },
        "suggested_fix": { "type": "string", "minLength": 1 },
        "docs_ref": { "type": "string", "minLength": 1 }
      }
    },
    "usage_metrics": {
      "type": "object",
      "additionalProperties": false,
      "required": [
        "tool_catalog_bytes",
        "tool_catalog_est_tokens_cl100k",
        "tool_catalog_est_tokens_o200k",
        "tool_count",
        "avg_tool_description_tokens",
        "max_tool_description_tokens",
        "input_schema_bytes_total",
        "input_schema_est_tokens_total",
        "example_payload_est_tokens_total",
        "replay_transcript_est_tokens_total",
        "response_payload_est_tokens_p50",
        "response_payload_est_tokens_p95",
        "metadata_to_payload_ratio_pct",
        "estimator_family",
        "estimator_version",
        "estimator_confidence"
      ],
      "properties": {
        "tool_catalog_bytes": { "type": "integer", "minimum": 0 },
        "tool_catalog_est_tokens_cl100k": { "type": "integer", "minimum": 0 },
        "tool_catalog_est_tokens_o200k": { "type": "integer", "minimum": 0 },
        "tool_count": { "type": "integer", "minimum": 0 },
        "avg_tool_description_tokens": { "type": "integer", "minimum": 0 },
        "max_tool_description_tokens": { "type": "integer", "minimum": 0 },
        "avg_tool_description_tokens_exact": { "type": ["integer", "null"], "minimum": 0 },
        "avg_tool_description_tokens_observed": { "type": ["integer", "null"], "minimum": 0 },
        "max_tool_description_tokens_exact": { "type": ["integer", "null"], "minimum": 0 },
        "max_tool_description_tokens_observed": { "type": ["integer", "null"], "minimum": 0 },
        "input_schema_bytes_total": { "type": "integer", "minimum": 0 },
        "input_schema_est_tokens_total": { "type": "integer", "minimum": 0 },
        "input_schema_tokens_exact_total": { "type": ["integer", "null"], "minimum": 0 },
        "input_schema_tokens_observed_total": { "type": ["integer", "null"], "minimum": 0 },
        "example_payload_est_tokens_total": { "type": "integer", "minimum": 0 },
        "replay_transcript_est_tokens_total": { "type": "integer", "minimum": 0 },
        "response_payload_est_tokens_p50": { "type": "integer", "minimum": 0 },
        "response_payload_est_tokens_p95": { "type": "integer", "minimum": 0 },
        "response_payload_tokens_exact_p50": { "type": ["integer", "null"], "minimum": 0 },
        "response_payload_tokens_exact_p95": { "type": ["integer", "null"], "minimum": 0 },
        "response_payload_tokens_observed_p50": { "type": ["integer", "null"], "minimum": 0 },
        "response_payload_tokens_observed_p95": { "type": ["integer", "null"], "minimum": 0 },
        "metadata_to_payload_ratio_pct": { "type": "integer", "minimum": 0 },
        "usage_mode": {
          "type": "string",
          "enum": ["estimate", "tokenizer_exact", "trace_observed", "mixed"]
        },
        "usage_confidence": { "type": "string", "enum": ["low", "medium", "high"] },
        "tokenizer_id": { "type": ["string", "null"] },
        "trace_source": { "type": ["string", "null"] },
        "tool_catalog_tokens_exact": { "type": ["integer", "null"], "minimum": 0 },
        "tool_catalog_tokens_observed": { "type": ["integer", "null"], "minimum": 0 },
        "estimator_family": { "type": "string", "minLength": 1 },
        "estimator_version": { "type": "string", "minLength": 1 },
        "estimator_confidence": { "type": "string", "enum": ["low", "medium", "high"] }
      }
    }
  }
}
