{
  "schema_version": "x07.mcp.scan.report@0.4.0",
  "tool": "hardproof",
  "tool_family": "hardproof",
  "tool_version": "0.4.0-beta.2",
  "report_kind": "scan",
  "target": {
    "kind": "mcp_server",
    "transport": "streamable_http",
    "ref": "http://localhost:3000/mcp",
    "meta": {}
  },
  "transport": "streamable_http",
  "generated_at": "2026-04-04T00:00:00Z",
  "methodology_version": "0.4.0",
  "status": "warn",
  "overall_status": "warn",
  "score_available": true,
  "score_mode": "partial",
  "score_truth_status": "partial",
  "score_weight_present": 80,
  "overall_score": null,
  "partial_score": 90,
  "dimension_coverage": {
    "conformance": true,
    "security": true,
    "performance": true,
    "trust": false,
    "reliability": true
  },
  "unknown_dimensions": [
    "trust"
  ],
  "partial_reasons": [
    "TRUST-NOT-EVALUABLE",
    "SERVER-JSON-MISSING",
    "WEIGHT-COVERAGE-BELOW-FULL",
    "UNKNOWN-DIMENSIONS"
  ],
  "gating_reasons": [
    "TRUST-NOT-EVALUABLE",
    "SERVER-JSON-MISSING",
    "WEIGHT-COVERAGE-BELOW-FULL",
    "UNKNOWN-DIMENSIONS"
  ],
  "dimensions": [
    {
      "name": "conformance",
      "status": "pass",
      "score": 95,
      "weight": 0.3,
      "metrics": {},
      "finding_refs": [],
      "artifact_refs": []
    },
    {
      "name": "security",
      "status": "pass",
      "score": 90,
      "weight": 0.2,
      "metrics": {},
      "finding_refs": [],
      "artifact_refs": []
    },
    {
      "name": "performance",
      "status": "warn",
      "score": 80,
      "weight": 0.15,
      "metrics": {},
      "finding_refs": [],
      "artifact_refs": []
    },
    {
      "name": "trust",
      "status": "unknown",
      "score": null,
      "weight": 0.2,
      "metrics": {},
      "finding_refs": [],
      "artifact_refs": []
    },
    {
      "name": "reliability",
      "status": "pass",
      "score": 92,
      "weight": 0.15,
      "metrics": {},
      "finding_refs": [],
      "artifact_refs": []
    }
  ],
  "usage_metrics": {
    "tool_catalog_bytes": 1000,
    "tool_catalog_est_tokens_cl100k": 250,
    "tool_catalog_est_tokens_o200k": 250,
    "tool_count": 6,
    "avg_tool_description_tokens": 40,
    "max_tool_description_tokens": 80,
    "input_schema_bytes_total": 800,
    "input_schema_est_tokens_total": 200,
    "example_payload_est_tokens_total": 0,
    "replay_transcript_est_tokens_total": 0,
    "response_payload_est_tokens_p50": 0,
    "response_payload_est_tokens_p95": 0,
    "metadata_to_payload_ratio_pct": 400,
    "estimator_family": "bytes_per_token_v1",
    "estimator_confidence": "low",
    "estimator_version": "v1"
  },
  "findings": [],
  "artifacts": [],
  "spec_baseline": "mcp@2025-11-25",
  "report_digest": "aaaaaaaaaaaaaaaaaaaaaaaaaaaaaaaaaaaaaaaaaaaaaaaaaaaaaaaaaaaaaaaa",
  "run_id": "scan-fixture",
  "elapsed_ms": 123
}
