{
  "schema_version": "x07.mcp.scan.report@0.4.0",
  "tool": "hardproof",
  "tool_family": "hardproof",
  "tool_version": "0.4.0-beta.4",
  "report_kind": "scan",
  "target": {
    "kind": "mcp_server",
    "transport": "streamable_http",
    "ref": "https://registry.x07.io/mcp",
    "meta": {}
  },
  "transport": "streamable_http",
  "generated_at": "2026-04-04T00:00:00Z",
  "methodology_version": "0.4.0",
  "status": "pass",
  "overall_status": "pass",
  "score_available": true,
  "score_mode": "full",
  "score_truth_status": "publishable",
  "score_weight_present": 100,
  "overall_score": 96,
  "partial_score": 96,
  "dimension_coverage": {
    "conformance": true,
    "security": true,
    "performance": true,
    "trust": true,
    "reliability": true
  },
  "unknown_dimensions": [],
  "partial_reasons": [],
  "gating_reasons": [],
  "dimensions": [
    {
      "name": "conformance",
      "status": "pass",
      "score": 96,
      "weight": 0.3,
      "metrics": {},
      "finding_refs": [],
      "artifact_refs": []
    },
    {
      "name": "security",
      "status": "pass",
      "score": 96,
      "weight": 0.2,
      "metrics": {},
      "finding_refs": [],
      "artifact_refs": []
    },
    {
      "name": "performance",
      "status": "pass",
      "score": 96,
      "weight": 0.15,
      "metrics": {},
      "finding_refs": [],
      "artifact_refs": []
    },
    {
      "name": "trust",
      "status": "pass",
      "score": 96,
      "weight": 0.2,
      "metrics": {},
      "finding_refs": [],
      "artifact_refs": []
    },
    {
      "name": "reliability",
      "status": "pass",
      "score": 96,
      "weight": 0.15,
      "metrics": {},
      "finding_refs": [],
      "artifact_refs": []
    }
  ],
  "usage_metrics": {
    "tool_catalog_bytes": 800,
    "tool_catalog_est_tokens_cl100k": 200,
    "tool_catalog_est_tokens_o200k": 200,
    "tool_count": 4,
    "avg_tool_description_tokens": 28,
    "max_tool_description_tokens": 40,
    "input_schema_bytes_total": 500,
    "input_schema_est_tokens_total": 125,
    "example_payload_est_tokens_total": 0,
    "replay_transcript_est_tokens_total": 0,
    "response_payload_est_tokens_p50": 40,
    "response_payload_est_tokens_p95": 65,
    "metadata_to_payload_ratio_pct": 60,
    "estimator_family": "bytes_per_token_v1",
    "estimator_confidence": "low",
    "estimator_version": "v1"
  },
  "findings": [],
  "artifacts": [],
  "spec_baseline": "mcp@2025-11-25",
  "report_digest": "bbbbbbbbbbbbbbbbbbbbbbbbbbbbbbbbbbbbbbbbbbbbbbbbbbbbbbbbbbbbbbbb",
  "run_id": "scan-fixture-publishable",
  "elapsed_ms": 98
}
