{
  "schema_version": "x07.mcp.scan.report@0.4.0",
  "tool": "hardproof",
  "tool_family": "hardproof",
  "tool_version": "0.4.0-beta.2",
  "report_kind": "scan",
  "target": {
    "kind": "mcp_server",
    "transport": "streamable_http",
    "ref": "http://localhost:3000/mcp",
    "meta": {}
  },
  "transport": "streamable_http",
  "generated_at": "2026-04-04T00:00:00Z",
  "methodology_version": "0.4.0",
  "status": "warn",
  "overall_status": "warn",
  "score_available": true,
  "score_mode": "full",
  "score_truth_status": "publishable",
  "score_weight_present": 100,
  "overall_score": 91,
  "partial_score": 91,
  "dimension_coverage": {
    "conformance": true,
    "security": true,
    "performance": true,
    "trust": true,
    "reliability": true
  },
  "unknown_dimensions": [],
  "partial_reasons": [],
  "gating_reasons": [],
  "dimensions": [
    {
      "name": "conformance",
      "status": "pass",
      "score": 96,
      "weight": 0.3,
      "metrics": {},
      "finding_refs": [],
      "artifact_refs": []
    },
    {
      "name": "security",
      "status": "pass",
      "score": 96,
      "weight": 0.2,
      "metrics": {},
      "finding_refs": [],
      "artifact_refs": []
    },
    {
      "name": "performance",
      "status": "pass",
      "score": 96,
      "weight": 0.15,
      "metrics": {},
      "finding_refs": [],
      "artifact_refs": []
    },
    {
      "name": "trust",
      "status": "pass",
      "score": 96,
      "weight": 0.2,
      "metrics": {},
      "finding_refs": [],
      "artifact_refs": []
    },
    {
      "name": "reliability",
      "status": "warn",
      "score": 65,
      "weight": 0.15,
      "metrics": {
        "replay_stable": false,
        "malformed_json_ok": true,
        "invalid_jsonrpc_ok": true,
        "oversize_request_ok": true
      },
      "finding_refs": [
        "REL-REPLAY-DRIFT"
      ],
      "artifact_refs": [
        "reliability.replay.json"
      ]
    }
  ],
  "usage_metrics": {
    "tool_catalog_bytes": 800,
    "tool_catalog_est_tokens_cl100k": 200,
    "tool_catalog_est_tokens_o200k": 200,
    "tool_count": 4,
    "avg_tool_description_tokens": 28,
    "max_tool_description_tokens": 40,
    "input_schema_bytes_total": 500,
    "input_schema_est_tokens_total": 125,
    "example_payload_est_tokens_total": 0,
    "replay_transcript_est_tokens_total": 0,
    "response_payload_est_tokens_p50": 40,
    "response_payload_est_tokens_p95": 65,
    "metadata_to_payload_ratio_pct": 60,
    "estimator_family": "bytes_per_token_v1",
    "estimator_confidence": "low",
    "estimator_version": "v1"
  },
  "findings": [
    {
      "code": "REL-REPLAY-DRIFT",
      "dimension": "reliability",
      "severity": "warning",
      "title": "Replay outputs drifted across repeated runs",
      "summary": "Repeated replay sessions produced different digests for the same target behavior envelope.",
      "evidence": {
        "replay_stable": false
      },
      "suggested_fix": "Make failure envelopes and replay outputs deterministic across repeated runs.",
      "docs_ref": "https://x07.io/docs/hardproof/findings/REL-REPLAY-DRIFT"
    }
  ],
  "artifacts": [
    {
      "id": "reliability.replay.json",
      "kind": "report",
      "path": "reliability.replay.json",
      "digest": "eeeeeeeeeeeeeeeeeeeeeeeeeeeeeeeeeeeeeeeeeeeeeeeeeeeeeeeeeeeeeeee",
      "content_type": "application/json"
    }
  ],
  "spec_baseline": "mcp@2025-11-25",
  "report_digest": "eeeeeeeeeeeeeeeeeeeeeeeeeeeeeeeeeeeeeeeeeeeeeeeeeeeeeeeeeeeeeeee",
  "run_id": "scan-fixture-reliability-drift",
  "elapsed_ms": 341
}
