{
  "schema_version": "x07.mcp.scan.report@0.4.0",
  "tool": "hardproof",
  "tool_family": "hardproof",
  "tool_version": "0.4.0-beta.2",
  "report_kind": "scan",
  "target": {
    "kind": "mcp_server",
    "transport": "streamable_http",
    "ref": "https://demo.invalid/mcp",
    "meta": {}
  },
  "transport": "streamable_http",
  "generated_at": "2026-04-04T00:00:00Z",
  "methodology_version": "0.4.0",
  "status": "warn",
  "overall_status": "warn",
  "score_available": true,
  "score_mode": "full",
  "score_truth_status": "publishable",
  "score_weight_present": 100,
  "overall_score": 94,
  "partial_score": 94,
  "dimension_coverage": {
    "conformance": true,
    "security": true,
    "performance": true,
    "trust": true,
    "reliability": true
  },
  "unknown_dimensions": [],
  "partial_reasons": [],
  "gating_reasons": [],
  "dimensions": [
    {
      "name": "conformance",
      "status": "pass",
      "score": 96,
      "weight": 0.3,
      "metrics": {},
      "finding_refs": [],
      "artifact_refs": []
    },
    {
      "name": "security",
      "status": "warn",
      "score": 90,
      "weight": 0.2,
      "metrics": {
        "auth_challenge_status_code": 401,
        "auth_expectation_mismatch": false,
        "auth_protection_status": "required",
        "command_risk_pattern_count": 3,
        "descriptor_bytes": 1120,
        "families": {
          "auth_exposure": {
            "auth_protection_status": "required",
            "status": "bounded"
          },
          "command_surface": {
            "pattern_count": 3,
            "status": "risky"
          },
          "descriptor_drift": {
            "drift_kind": "none",
            "status": "stable"
          },
          "injection_pattern": {
            "pattern_count": 0,
            "status": "clear"
          },
          "transport_exposure": {
            "status": "bounded"
          }
        },
        "host_origin_guard_ok": true,
        "injection_pattern_count": 0,
        "metadata_drift_kind": "none",
        "remote_http_without_tls": false
      },
      "finding_refs": [
        "SEC-COMMAND-RISK-PATTERN"
      ],
      "artifact_refs": []
    },
    {
      "name": "performance",
      "status": "pass",
      "score": 96,
      "weight": 0.15,
      "metrics": {},
      "finding_refs": [],
      "artifact_refs": []
    },
    {
      "name": "trust",
      "status": "pass",
      "score": 96,
      "weight": 0.2,
      "metrics": {},
      "finding_refs": [],
      "artifact_refs": []
    },
    {
      "name": "reliability",
      "status": "pass",
      "score": 96,
      "weight": 0.15,
      "metrics": {},
      "finding_refs": [],
      "artifact_refs": []
    }
  ],
  "usage_metrics": {
    "tool_catalog_bytes": 940,
    "tool_catalog_est_tokens_cl100k": 235,
    "tool_catalog_est_tokens_o200k": 209,
    "tool_count": 5,
    "avg_tool_description_tokens": 28,
    "max_tool_description_tokens": 42,
    "input_schema_bytes_total": 560,
    "input_schema_est_tokens_total": 140,
    "example_payload_est_tokens_total": 0,
    "replay_transcript_est_tokens_total": 0,
    "response_payload_est_tokens_p50": 44,
    "response_payload_est_tokens_p95": 70,
    "metadata_to_payload_ratio_pct": 66,
    "estimator_family": "bytes_per_token_v1",
    "estimator_confidence": "low",
    "estimator_version": "v1"
  },
  "findings": [
    {
      "code": "SEC-COMMAND-RISK-PATTERN",
      "dimension": "security",
      "severity": "warning",
      "title": "Command-risk parameter surface",
      "summary": "Tool metadata exposes command or shell execution patterns that deserve manual review.",
      "evidence": {
        "pattern_count": 3
      },
      "suggested_fix": "Prefer structured arguments over free-form command execution surfaces.",
      "docs_ref": "https://x07.io/docs/hardproof/findings/SEC-COMMAND-RISK-PATTERN"
    }
  ],
  "artifacts": [],
  "spec_baseline": "mcp@2025-11-25",
  "report_digest": "3333333333333333333333333333333333333333333333333333333333333333",
  "run_id": "scan-fixture-security-command-surface",
  "elapsed_ms": 141
}
