{
  "schema_version": "x07.mcp.scan.report@0.4.0",
  "tool": "hardproof",
  "tool_family": "hardproof",
  "tool_version": "0.4.0-beta.2",
  "report_kind": "scan",
  "target": {
    "kind": "mcp_server",
    "transport": "streamable_http",
    "ref": "https://demo.invalid/mcp",
    "meta": {}
  },
  "transport": "streamable_http",
  "generated_at": "2026-04-04T00:00:00Z",
  "methodology_version": "0.4.0",
  "status": "fail",
  "overall_status": "fail",
  "score_available": true,
  "score_mode": "full",
  "score_truth_status": "publishable",
  "score_weight_present": 100,
  "overall_score": 88,
  "partial_score": 88,
  "dimension_coverage": {
    "conformance": true,
    "security": true,
    "performance": true,
    "trust": true,
    "reliability": true
  },
  "unknown_dimensions": [],
  "partial_reasons": [],
  "gating_reasons": [
    "CRITICAL-SECURITY-FINDINGS"
  ],
  "dimensions": [
    {
      "name": "conformance",
      "status": "pass",
      "score": 96,
      "weight": 0.3,
      "metrics": {},
      "finding_refs": [],
      "artifact_refs": []
    },
    {
      "name": "security",
      "status": "fail",
      "score": 60,
      "weight": 0.2,
      "metrics": {
        "auth_challenge_status_code": 401,
        "auth_expectation_mismatch": false,
        "auth_protection_status": "required",
        "command_risk_pattern_count": 0,
        "descriptor_bytes": 740,
        "families": {
          "auth_exposure": {
            "auth_protection_status": "required",
            "status": "bounded"
          },
          "command_surface": {
            "pattern_count": 0,
            "status": "clear"
          },
          "descriptor_drift": {
            "drift_kind": "tools_list",
            "status": "semantic_drift"
          },
          "injection_pattern": {
            "pattern_count": 0,
            "status": "clear"
          },
          "transport_exposure": {
            "status": "bounded"
          }
        },
        "host_origin_guard_ok": true,
        "injection_pattern_count": 0,
        "metadata_drift_kind": "tools_list",
        "remote_http_without_tls": false
      },
      "finding_refs": [
        "SEC-TOOLS-LIST-DRIFT"
      ],
      "artifact_refs": []
    },
    {
      "name": "performance",
      "status": "pass",
      "score": 96,
      "weight": 0.15,
      "metrics": {},
      "finding_refs": [],
      "artifact_refs": []
    },
    {
      "name": "trust",
      "status": "pass",
      "score": 96,
      "weight": 0.2,
      "metrics": {},
      "finding_refs": [],
      "artifact_refs": []
    },
    {
      "name": "reliability",
      "status": "pass",
      "score": 96,
      "weight": 0.15,
      "metrics": {},
      "finding_refs": [],
      "artifact_refs": []
    }
  ],
  "usage_metrics": {
    "tool_catalog_bytes": 820,
    "tool_catalog_est_tokens_cl100k": 205,
    "tool_catalog_est_tokens_o200k": 183,
    "tool_count": 4,
    "avg_tool_description_tokens": 24,
    "max_tool_description_tokens": 36,
    "input_schema_bytes_total": 480,
    "input_schema_est_tokens_total": 120,
    "example_payload_est_tokens_total": 0,
    "replay_transcript_est_tokens_total": 0,
    "response_payload_est_tokens_p50": 40,
    "response_payload_est_tokens_p95": 64,
    "metadata_to_payload_ratio_pct": 61,
    "estimator_family": "bytes_per_token_v1",
    "estimator_confidence": "low",
    "estimator_version": "v1"
  },
  "findings": [
    {
      "code": "SEC-TOOLS-LIST-DRIFT",
      "dimension": "security",
      "severity": "critical",
      "title": "Tools list drift",
      "summary": "Repeated tools/list results are not stable; this can enable tool-poisoning attacks.",
      "evidence": {
        "metadata_drift_kind": "tools_list"
      },
      "suggested_fix": "Make tools/list deterministic and stable across repeated calls.",
      "docs_ref": "https://x07.io/docs/hardproof/findings/SEC-TOOLS-LIST-DRIFT"
    }
  ],
  "artifacts": [],
  "spec_baseline": "mcp@2025-11-25",
  "report_digest": "1111111111111111111111111111111111111111111111111111111111111111",
  "run_id": "scan-fixture-security-descriptor-drift",
  "elapsed_ms": 143
}
