{"artifacts":[{"content_type":"application/json; charset=utf-8","digest":"3fbf386a860f144c1073ea3a3eb1646348d6b813f43d0389ba66c7b694cb16fd","id":"conformance.summary.json","kind":"conformance_artifact","path":"conformance.summary.json"},{"content_type":"application/json","digest":"edd2eb2083454a55aa059861ea6c58a560e83e5cd24c8c7566bb93f1316395d6","id":"perf.samples.json","kind":"report","path":"perf.samples.json"},{"content_type":"application/json","digest":"ee8280a570f1ae3acc0010a827b5771a474418eb6be60fb1724bdba2488bb652","id":"reliability.cases.json","kind":"report","path":"reliability.cases.json"},{"content_type":"application/json","digest":"5cb79bcd05ae56b22b94572bed06374d439a00d9d56f65e5075f6f8afc46ac48","id":"reliability.replay.json","kind":"report","path":"reliability.replay.json"},{"content_type":"application/json; charset=utf-8","digest":"761e9417ab6db48c31375ed04a6e6c030dbd74f28f802158e55fae2e8358241f","id":"usage.tools.list.json","kind":"usage_artifact","path":"tools.list.json"}],"dimension_coverage":{"conformance":true,"performance":true,"reliability":true,"security":true,"trust":false},"dimensions":[{"artifact_refs":["conformance.summary.json"],"finding_refs":["CONFORMANCE.server-sse-multiple-streams-session","CONFORMANCE.localhost-host-rebinding-rejected","CONFORMANCE.localhost-host-valid-accepted"],"metrics":{"failed":0,"full_suite":false,"passed":6,"raw_dir":"release_qa/external_smoke_matrix/0.4.0-beta.2/stdio-x07lang-mcp/scan/raw/20260408-153051","total":9,"warnings":3},"name":"conformance","score":66,"status":"warn","weight":0.3},{"artifact_refs":[],"finding_refs":["SEC-DESCRIPTOR-BLOAT"],"metrics":{"auth_challenge_status_code":0,"auth_expectation_mismatch":false,"auth_protection_status":"n/a","command_risk_pattern_count":0,"descriptor_bytes":12035,"families":{"auth_exposure":{"auth_protection_status":"n/a","status":"not_applicable"},"command_surface":{"pattern_count":0,"status":"clear"},"descriptor_drift":{"drift_kind":"none","status":"stable"},"injection_pattern":{"pattern_count":0,"status":"clear"},"transport_exposure":{"status":"not_applicable"}},"host_origin_guard_ok":true,"injection_pattern_count":0,"metadata_drift_kind":"none","remote_http_without_tls":false},"name":"security","score":95,"status":"warn","weight":0.2},{"artifact_refs":["perf.samples.json"],"finding_refs":["PERF-TOOLS-CALL-FAILED"],"metrics":{"budget_fuel_concurrent_probe":10000000,"budget_fuel_discover":10000000,"budget_fuel_ping_samples":10000000,"budget_fuel_tool_call_samples":10000000,"concurrent_ok_n":0,"concurrent_slots":0,"ping_p95_ms":0,"ping_p99_ms":0,"ping_sample_count":6,"throughput_calls_per_sec":0,"tool_call_confidence":"low","tool_call_p95_ms":0,"tool_call_p99_ms":0,"tool_call_sample_count":4,"workload_profile":"smoke"},"name":"performance","score":90,"status":"warn","weight":0.15},{"artifact_refs":[],"finding_refs":["TRUST-NOT-EVALUABLE"],"metrics":{"bundle_consistency":"unknown","bundle_status":"unknown","identity_confidence":"low","publisher_identity":"warn","publisher_status":"warn","signature_integrity":"unknown","signature_status":"unknown","tlog_status":"unknown","transparency_evidence":"unknown","trust_evaluable":false},"name":"trust","score":null,"status":"unknown","weight":0.2},{"artifact_refs":["reliability.cases.json","reliability.replay.json"],"finding_refs":["REL-MALFORMED-JSON-UNHANDLED","REL-OVERSIZE-REQ-UNHANDLED"],"metrics":{"invalid_elapsed_ms":530,"invalid_jsonrpc_ok":true,"invalid_status_code":0,"malformed_elapsed_ms":580,"malformed_json_ok":false,"malformed_status_code":0,"oversize_elapsed_ms":517,"oversize_request_ok":false,"oversize_status_code":0,"ping_drift":false,"ran":true,"replay_stable":true,"restart_reconnect_ok":true,"timeout_cancel_ok":true,"tools_list_drift":false,"unknown_method_drift":false},"name":"reliability","score":70,"status":"fail","weight":0.15}],"elapsed_ms":13704,"findings":[{"code":"CONFORMANCE.server-sse-multiple-streams-session","dimension":"conformance","docs_ref":"hardproof:explain:CONFORMANCE.server-sse-multiple-streams-session","evidence":{"check_id":"server-sse-multiple-streams-session"},"severity":"warning","suggested_fix":"Fix the warning conformance scenario and re-run hardproof scan.","summary":"Server provides session ID for multiple streams test","title":"Server provides session ID for multiple streams test"},{"code":"CONFORMANCE.localhost-host-rebinding-rejected","dimension":"conformance","docs_ref":"hardproof:explain:CONFORMANCE.localhost-host-rebinding-rejected","evidence":{"check_id":"localhost-host-rebinding-rejected"},"severity":"warning","suggested_fix":"Fix the warning conformance scenario and re-run hardproof scan.","summary":"Server rejects requests with non-localhost Host/Origin headers","title":"Server rejects requests with non-localhost Host/Origin headers"},{"code":"CONFORMANCE.localhost-host-valid-accepted","dimension":"conformance","docs_ref":"hardproof:explain:CONFORMANCE.localhost-host-valid-accepted","evidence":{"check_id":"localhost-host-valid-accepted"},"severity":"warning","suggested_fix":"Fix the warning conformance scenario and re-run hardproof scan.","summary":"Server accepts requests with valid localhost Host/Origin headers","title":"Server accepts requests with valid localhost Host/Origin headers"},{"code":"SEC-DESCRIPTOR-BLOAT","dimension":"security","docs_ref":"https://x07.io/docs/hardproof/findings/SEC-DESCRIPTOR-BLOAT","evidence":{"descriptor_bytes":12035},"severity":"warning","suggested_fix":"Trim descriptions, examples, and redundant schema prose.","summary":"Very large tool metadata increases prompt-injection surface and review burden.","title":"Oversized tool descriptors"},{"code":"PERF-TOOLS-CALL-FAILED","dimension":"performance","docs_ref":"https://x07.io/docs/hardproof/findings/PERF-TOOLS-CALL-FAILED","evidence":{},"severity":"warning","suggested_fix":"Expose at least one low-latency tool that can be called with empty arguments.","summary":"Representative tools/call attempts did not succeed.","title":"Tool calls failed"},{"code":"TRUST-NOT-EVALUABLE","dimension":"trust","docs_ref":"https://x07.io/docs/hardproof/findings/TRUST-NOT-EVALUABLE","evidence":{},"severity":"info","suggested_fix":"Provide --server-json and, when available, --mcpb so trust checks can run.","summary":"Trust checks could not run because the scan did not receive enough release metadata to evaluate trust.","title":"Trust not evaluable"},{"code":"REL-MALFORMED-JSON-UNHANDLED","dimension":"reliability","docs_ref":"https://x07.io/docs/hardproof/findings/REL-MALFORMED-JSON-UNHANDLED","evidence":{"status_code":0},"severity":"critical","suggested_fix":"Return a stable 4xx response or JSON-RPC error for malformed JSON bodies.","summary":"Server did not reject or error on malformed JSON request bodies.","title":"Malformed JSON not handled"},{"code":"REL-OVERSIZE-REQ-UNHANDLED","dimension":"reliability","docs_ref":"https://x07.io/docs/hardproof/findings/REL-OVERSIZE-REQ-UNHANDLED","evidence":{"status_code":0},"severity":"warning","suggested_fix":"Reject oversized payloads with a stable error response.","summary":"Server did not handle an oversized request body gracefully.","title":"Oversized requests not handled"},{"code":"USAGE-CATALOG-BLOAT","dimension":"usage","docs_ref":"https://x07.io/docs/hardproof/findings/USAGE-CATALOG-BLOAT","evidence":{"estimated_tokens":3009,"tool_count":18},"severity":"warning","suggested_fix":"Reduce tool count and shorten descriptions/examples to lower catalog footprint.","summary":"tools/list consumes excessive context relative to the tool count.","title":"Tool catalog too large"},{"code":"USAGE-SCHEMA-BLOAT","dimension":"usage","docs_ref":"https://x07.io/docs/hardproof/findings/USAGE-SCHEMA-BLOAT","evidence":{"estimated_tokens":2075,"schema_bytes_total":8300},"severity":"warning","suggested_fix":"Simplify tool input schemas and remove redundant fields.","summary":"Total tool input schemas are large and may consume excessive context.","title":"Input schema bloat"}],"gating_reasons":["TRUST-NOT-EVALUABLE","SERVER-JSON-MISSING","WEIGHT-COVERAGE-BELOW-FULL","UNKNOWN-DIMENSIONS"],"generated_at":"2026-04-08T15:30:51.287118000Z","methodology_version":"0.4.0","overall_score":null,"overall_status":"fail","partial_reasons":["TRUST-NOT-EVALUABLE","SERVER-JSON-MISSING","WEIGHT-COVERAGE-BELOW-FULL","UNKNOWN-DIMENSIONS"],"partial_score":78,"report_digest":"7ff805ec05aed283407a7e5417ba905d86ef4f1859fd074d8fc0326f9b7b4618","report_kind":"scan","run_id":"f624d0b73ca0abc9","schema_version":"x07.mcp.scan.report@0.4.0","score_available":true,"score_mode":"partial","score_truth_status":"partial","score_weight_present":80,"spec_baseline":"mcp@2025-11-25","status":"fail","target":{"kind":"mcp_server","meta":{"cwd":"out/release-qa.FHO7bX/x07lang-mcp.bundle","env_file":"release_qa/external_smoke_matrix/0.4.0-beta.2/stdio-x07lang-mcp/x07lang-mcp.env","env_keys":[]},"ref":"server/x07lang-mcp","transport":"stdio"},"tool":"hardproof","tool_family":"hardproof","tool_version":"0.4.0-beta.2","transport":"stdio","unknown_dimensions":["trust"],"usage_metrics":{"avg_tool_description_tokens":18,"estimator_confidence":"low","estimator_family":"bytes_per_token_v1","estimator_version":"v1","example_payload_est_tokens_total":0,"input_schema_bytes_total":8300,"input_schema_est_tokens_total":2075,"max_tool_description_tokens":27,"metadata_to_payload_ratio_pct":31671,"replay_transcript_est_tokens_total":0,"response_payload_est_tokens_p50":10,"response_payload_est_tokens_p95":10,"tool_catalog_bytes":12035,"tool_catalog_est_tokens_cl100k":3009,"tool_catalog_est_tokens_o200k":2675,"tool_count":18}}
