{"artifacts":[{"content_type":"application/json; charset=utf-8","digest":"6a3f7eb977fa0a0b0bfc0469cb7c106b2ac06aed6b09d06a01abdfa487b93486","id":"conformance.summary.json","kind":"conformance_artifact","path":"conformance.summary.json"},{"content_type":"application/json","digest":"46066bc1d2962fd16c3eff1bce94590af8aafcaa2e25c1e4e6f6957e5d2117aa","id":"perf.samples.json","kind":"report","path":"perf.samples.json"},{"content_type":"application/json","digest":"b5f2871ab3f8af302e15947fb7f2f56e7390b77d464cd63b9539ba5350e46a5e","id":"reliability.cases.json","kind":"report","path":"reliability.cases.json"},{"content_type":"application/json","digest":"8c94c0bb35c9ebcff4b816de59f02f814ac185196d3d19d289faf8c8783cd36e","id":"reliability.replay.json","kind":"report","path":"reliability.replay.json"},{"content_type":"application/json; charset=utf-8","digest":"137acf58086dd96aea500a478838439ce444bae79ebfd651372e180bbd5e28d6","id":"usage.tools.list.json","kind":"usage_artifact","path":"tools.list.json"}],"dimension_coverage":{"conformance":true,"performance":true,"reliability":true,"security":true,"trust":false},"dimensions":[{"artifact_refs":["conformance.summary.json"],"finding_refs":[],"metrics":{"failed":0,"full_suite":false,"passed":9,"raw_dir":"release_qa/external_smoke_matrix/0.4.0-beta.2/http-postgres-mcp-partial/scan/raw/20260408-153146","total":9,"warnings":0},"name":"conformance","score":100,"status":"pass","weight":0.3},{"artifact_refs":[],"finding_refs":[],"metrics":{"auth_challenge_status_code":0,"auth_expectation_mismatch":false,"auth_protection_status":"missing","command_risk_pattern_count":0,"descriptor_bytes":741,"families":{"auth_exposure":{"auth_protection_status":"missing","status":"local_only"},"command_surface":{"pattern_count":0,"status":"clear"},"descriptor_drift":{"drift_kind":"none","status":"stable"},"injection_pattern":{"pattern_count":0,"status":"clear"},"transport_exposure":{"status":"local_only"}},"host_origin_guard_ok":true,"injection_pattern_count":0,"metadata_drift_kind":"none","remote_http_without_tls":false},"name":"security","score":100,"status":"pass","weight":0.2},{"artifact_refs":["perf.samples.json"],"finding_refs":["PERF-CONCURRENT-TOOLS-CALL-LOW"],"metrics":{"budget_fuel_concurrent_probe":10000000,"budget_fuel_discover":10000000,"budget_fuel_ping_samples":10000000,"budget_fuel_tool_call_samples":10000000,"concurrent_ok_n":4,"concurrent_slots":4,"ping_p95_ms":146,"ping_p99_ms":146,"ping_sample_count":20,"throughput_calls_per_sec":6,"tool_call_confidence":"high","tool_call_p95_ms":167,"tool_call_p99_ms":167,"tool_call_sample_count":20,"workload_profile":"steady_small"},"name":"performance","score":83,"status":"warn","weight":0.15},{"artifact_refs":[],"finding_refs":["TRUST-NOT-EVALUABLE"],"metrics":{"bundle_consistency":"unknown","bundle_status":"unknown","identity_confidence":"low","publisher_identity":"warn","publisher_status":"warn","signature_integrity":"unknown","signature_status":"unknown","tlog_status":"unknown","transparency_evidence":"unknown","trust_evaluable":false},"name":"trust","score":null,"status":"unknown","weight":0.2},{"artifact_refs":["reliability.cases.json","reliability.replay.json"],"finding_refs":[],"metrics":{"invalid_elapsed_ms":144,"invalid_jsonrpc_ok":true,"invalid_status_code":200,"malformed_elapsed_ms":144,"malformed_json_ok":true,"malformed_status_code":400,"oversize_elapsed_ms":244,"oversize_request_ok":true,"oversize_status_code":200,"ping_drift":false,"ran":true,"replay_stable":true,"restart_reconnect_ok":true,"timeout_cancel_ok":true,"tools_list_drift":false,"unknown_method_drift":false},"name":"reliability","score":100,"status":"pass","weight":0.15}],"elapsed_ms":14174,"findings":[{"code":"PERF-CONCURRENT-TOOLS-CALL-LOW","dimension":"performance","docs_ref":"https://x07.io/docs/hardproof/findings/PERF-CONCURRENT-TOOLS-CALL-LOW","evidence":{},"severity":"warning","suggested_fix":"Audit concurrency limits and ensure the server is safe under bounded parallel calls.","summary":"Concurrent tools/call requests did not succeed reliably.","title":"Low concurrent tool-call success"},{"code":"TRUST-NOT-EVALUABLE","dimension":"trust","docs_ref":"https://x07.io/docs/hardproof/findings/TRUST-NOT-EVALUABLE","evidence":{},"severity":"info","suggested_fix":"Provide --server-json and, when available, --mcpb so trust checks can run.","summary":"Trust checks could not run because the scan did not receive enough release metadata to evaluate trust.","title":"Trust not evaluable"}],"gating_reasons":["TRUST-NOT-EVALUABLE","SERVER-JSON-MISSING","WEIGHT-COVERAGE-BELOW-FULL","UNKNOWN-DIMENSIONS"],"generated_at":"2026-04-08T15:31:46.849533000Z","methodology_version":"0.4.0","overall_score":null,"overall_status":"warn","partial_reasons":["TRUST-NOT-EVALUABLE","SERVER-JSON-MISSING","WEIGHT-COVERAGE-BELOW-FULL","UNKNOWN-DIMENSIONS"],"partial_score":96,"report_digest":"65edaaa3211f03313d6761eb8f455085292a678e92f0d16dd562043079f6292a","report_kind":"scan","run_id":"cd07d09b3c7b3fbb","schema_version":"x07.mcp.scan.report@0.4.0","score_available":true,"score_mode":"partial","score_truth_status":"partial","score_weight_present":80,"spec_baseline":"mcp@2025-11-25","status":"warn","target":{"kind":"mcp_server","meta":{},"ref":"http://127.0.0.1:8403/mcp","transport":"streamable_http"},"tool":"hardproof","tool_family":"hardproof","tool_version":"0.4.0-beta.2","transport":"streamable_http","unknown_dimensions":["trust"],"usage_metrics":{"avg_tool_description_tokens":14,"estimator_confidence":"low","estimator_family":"bytes_per_token_v1","estimator_version":"v1","example_payload_est_tokens_total":0,"input_schema_bytes_total":186,"input_schema_est_tokens_total":47,"max_tool_description_tokens":17,"metadata_to_payload_ratio_pct":2058,"replay_transcript_est_tokens_total":0,"response_payload_est_tokens_p50":9,"response_payload_est_tokens_p95":9,"tool_catalog_bytes":741,"tool_catalog_est_tokens_cl100k":186,"tool_catalog_est_tokens_o200k":165,"tool_count":3}}
