{"artifacts":[{"content_type":"application/json; charset=utf-8","digest":"dbf8bf709b6c494ee8ee448ceb97f2a27be15a140ac2ade275b5a3eb884a4866","id":"conformance.summary.json","kind":"conformance_artifact","path":"conformance.summary.json"},{"content_type":"application/json","digest":"21effdbf0c43cc8e99caae578265d87efdeed70ac5a2ff13e8b3c21e7046a2f9","id":"perf.samples.json","kind":"report","path":"perf.samples.json"},{"content_type":"application/json","digest":"e713f5986830407365ec7d08e26bb1ac66290717a7c75d89280a619885726fc8","id":"reliability.cases.json","kind":"report","path":"reliability.cases.json"},{"content_type":"application/json","digest":"8c94c0bb35c9ebcff4b816de59f02f814ac185196d3d19d289faf8c8783cd36e","id":"reliability.replay.json","kind":"report","path":"reliability.replay.json"},{"content_type":"application/json; charset=utf-8","digest":"137acf58086dd96aea500a478838439ce444bae79ebfd651372e180bbd5e28d6","id":"usage.tools.list.json","kind":"usage_artifact","path":"tools.list.json"}],"dimension_coverage":{"conformance":true,"performance":true,"reliability":true,"security":true,"trust":true},"dimensions":[{"artifact_refs":["conformance.summary.json"],"finding_refs":[],"metrics":{"failed":0,"full_suite":false,"passed":9,"raw_dir":"demos/postgres-public-beta/out/scan/raw/20260408-153249","total":9,"warnings":0},"name":"conformance","score":100,"status":"pass","weight":0.3},{"artifact_refs":[],"finding_refs":[],"metrics":{"auth_challenge_status_code":0,"auth_expectation_mismatch":false,"auth_protection_status":"missing","command_risk_pattern_count":0,"descriptor_bytes":741,"families":{"auth_exposure":{"auth_protection_status":"missing","status":"local_only"},"command_surface":{"pattern_count":0,"status":"clear"},"descriptor_drift":{"drift_kind":"none","status":"stable"},"injection_pattern":{"pattern_count":0,"status":"clear"},"transport_exposure":{"status":"local_only"}},"host_origin_guard_ok":true,"injection_pattern_count":0,"metadata_drift_kind":"none","remote_http_without_tls":false},"name":"security","score":100,"status":"pass","weight":0.2},{"artifact_refs":["perf.samples.json"],"finding_refs":["PERF-CONCURRENT-TOOLS-CALL-LOW"],"metrics":{"budget_fuel_concurrent_probe":10000000,"budget_fuel_discover":10000000,"budget_fuel_ping_samples":10000000,"budget_fuel_tool_call_samples":10000000,"concurrent_ok_n":4,"concurrent_slots":4,"ping_p95_ms":145,"ping_p99_ms":145,"ping_sample_count":20,"throughput_calls_per_sec":6,"tool_call_confidence":"high","tool_call_p95_ms":166,"tool_call_p99_ms":166,"tool_call_sample_count":20,"workload_profile":"steady_small"},"name":"performance","score":83,"status":"warn","weight":0.15},{"artifact_refs":[],"finding_refs":["TRUST-TRUSTPACK-MISSING"],"metrics":{"bundle_consistency":"pass","bundle_status":"pass","identity_confidence":"medium","publisher_identity":"pass","publisher_status":"pass","signature_integrity":"unknown","signature_status":"unknown","tlog_status":"unknown","transparency_evidence":"unknown","trust_evaluable":true},"name":"trust","score":80,"status":"warn","weight":0.2},{"artifact_refs":["reliability.cases.json","reliability.replay.json"],"finding_refs":[],"metrics":{"invalid_elapsed_ms":143,"invalid_jsonrpc_ok":true,"invalid_status_code":200,"malformed_elapsed_ms":140,"malformed_json_ok":true,"malformed_status_code":400,"oversize_elapsed_ms":240,"oversize_request_ok":true,"oversize_status_code":200,"ping_drift":false,"ran":true,"replay_stable":true,"restart_reconnect_ok":true,"timeout_cancel_ok":true,"tools_list_drift":false,"unknown_method_drift":false},"name":"reliability","score":100,"status":"pass","weight":0.15}],"elapsed_ms":14089,"findings":[{"code":"PERF-CONCURRENT-TOOLS-CALL-LOW","dimension":"performance","docs_ref":"https://x07.io/docs/hardproof/findings/PERF-CONCURRENT-TOOLS-CALL-LOW","evidence":{},"severity":"warning","suggested_fix":"Audit concurrency limits and ensure the server is safe under bounded parallel calls.","summary":"Concurrent tools/call requests did not succeed reliably.","title":"Low concurrent tool-call success"},{"code":"TRUST-TRUSTPACK-MISSING","dimension":"trust","docs_ref":"https://x07.io/docs/hardproof/findings/TRUST-TRUSTPACK-MISSING","evidence":{},"severity":"warning","suggested_fix":"Publish trustPack pins (registry, packId, packVersion, snapshotSha256, checkpointSha256) in server.json.","summary":"Publisher metadata is present but trustPack pins are missing, so transparency and signature checks cannot run.","title":"Trust pack metadata missing"}],"gating_reasons":[],"generated_at":"2026-04-08T15:32:49.720025000Z","methodology_version":"0.4.0","overall_score":93,"overall_status":"warn","partial_reasons":[],"partial_score":93,"report_digest":"6d26a1e03b2fcffd66429702b536d00d81544f15c633b31ae55619e86034565e","report_kind":"scan","run_id":"66fd182485d0faf9","schema_version":"x07.mcp.scan.report@0.4.0","score_available":true,"score_mode":"full","score_truth_status":"publishable","score_weight_present":100,"spec_baseline":"mcp@2025-11-25","status":"warn","target":{"kind":"mcp_server","meta":{},"ref":"http://127.0.0.1:8403/mcp","transport":"streamable_http"},"tool":"hardproof","tool_family":"hardproof","tool_version":"0.4.0-beta.2","transport":"streamable_http","unknown_dimensions":[],"usage_metrics":{"avg_tool_description_tokens":14,"estimator_confidence":"low","estimator_family":"bytes_per_token_v1","estimator_version":"v1","example_payload_est_tokens_total":0,"input_schema_bytes_total":186,"input_schema_est_tokens_total":47,"max_tool_description_tokens":17,"metadata_to_payload_ratio_pct":2058,"replay_transcript_est_tokens_total":0,"response_payload_est_tokens_p50":9,"response_payload_est_tokens_p95":9,"tool_catalog_bytes":741,"tool_catalog_est_tokens_cl100k":186,"tool_catalog_est_tokens_o200k":165,"tool_count":3}}
